{
  "id": "creative",
  "name": "创意艺术风 (Creative)",
  "description": "大胆配色、渐变插画感，充满活力与创造力",
  "icon": "🎨",
  "version": "2.0.0",
  "tags": ["creative", "colorful", "gradient", "art", "design"],
  "preview": {
    "primary":    "#f59e0b",
    "accent":     "#ec4899",
    "background": "#fdf4ff",
    "surface":    "#fff7f0",
    "text":       "#1c1917"
  },
  "variables": {
    "--base-color":       "#f59e0b",
    "--base-color-600":   "#d97706",
    "--base-color-500":   "#f59e0b",
    "--base-color-300":   "#fcd34d",
    "--bg-page":          "rgba(253,244,255,1)",
    "--bg-page-mid":      "rgba(255,237,250,1)",
    "--bg-page-end":      "rgba(255,249,235,1)",
    "--card-bg":          "rgba(255,255,255,0.88)",
    "--glass":            "rgba(255,255,255,0.75)",
    "--surface-1":        "#fff7f0",
    "--surface-2":        "#ffffff",
    "--border-color":     "#fed7aa",
    "--border-light":     "#fff3e0",
    "--ink":              "#1c1917",
    "--text-primary":     "#1c1917",
    "--text-secondary":   "#78716c",
    "--text-muted":       "#a8a29e",
    "--radius-xs":        "6px",
    "--radius-sm":        "10px",
    "--radius-md":        "14px",
    "--radius-lg":        "18px",
    "--radius-xl":        "22px",
    "--radius-2xl":       "28px",
    "--shadow-xs":        "0 1px 4px rgba(245,158,11,0.10)",
    "--shadow-sm":        "0 3px 10px rgba(245,158,11,0.12)",
    "--shadow-md":        "0 6px 18px rgba(236,72,153,0.14)",
    "--shadow-lg":        "0 12px 30px rgba(236,72,153,0.16)",
    "--blur-panel":       "20px",
    "--accent-gradient":  "linear-gradient(135deg,#f59e0b,#ec4899,#8b5cf6)",
    "--btn-radius":       "22px",
    "--input-border":     "#fed7aa",
    "--input-focus":      "#ec4899",
    "--card-hover-shadow": "0 16px 40px rgba(236,72,153,0.2)",
    "--card-hover-transform": "translateY(-4px) rotate(-0.5deg)",
    "--transition-speed": "0.4s"
  },
  "bodyClasses": ["theme-creative"],
  "darkMode": false,
  "backgroundImage": null,
  "fontFamily": "'Poppins', 'Nunito', sans-serif"
}
