{
  "id": "default",
  "name": "默认 (Default)",
  "description": "天蓝渐变背景，毛玻璃卡片，清新专业感",
  "icon": "🌤️",
  "version": "2.0.0",
  "tags": ["default", "blue", "gradient"],
  "preview": {
    "primary":    "#38bdf8",
    "accent":     "#818cf8",
    "background": "#f0f6ff",
    "surface":    "#ffffffd9",
    "text":       "#0f172a"
  },
  "variables": {
    "--base-color":       "#7dd3fc",
    "--base-color-600":   "#0891b2",
    "--base-color-500":   "#22d3ee",
    "--base-color-300":   "#a5f3fc",
    "--bg-page":          "rgba(245,250,255,1)",
    "--bg-page-mid":      "rgba(235,245,255,1)",
    "--bg-page-end":      "rgba(250,240,255,1)",
    "--card-bg":          "rgba(255,255,255,0.85)",
    "--glass":            "rgba(255,255,255,0.65)",
    "--surface-1":        "#f8fafc",
    "--surface-2":        "#ffffff",
    "--border-color":     "#e2e8f0",
    "--border-light":     "#f1f5f9",
    "--ink":              "#0f172a",
    "--text-primary":     "#1e293b",
    "--text-secondary":   "#64748b",
    "--text-muted":       "#94a3b8",
    "--radius-xs":        "4px",
    "--radius-sm":        "8px",
    "--radius-md":        "12px",
    "--radius-lg":        "16px",
    "--radius-xl":        "20px",
    "--radius-2xl":       "24px",
    "--shadow-xs":        "0 1px 2px rgba(0,0,0,0.05)",
    "--shadow-sm":        "0 2px 8px rgba(0,0,0,0.08)",
    "--shadow-md":        "0 4px 12px rgba(0,0,0,0.10)",
    "--shadow-lg":        "0 10px 24px rgba(16,24,40,0.12)",
    "--blur-panel":       "16px",
    "--accent-gradient":  "linear-gradient(90deg,#38bdf8,#818cf8)",
    "--btn-radius":       "12px",
    "--input-border":     "#e2e8f0",
    "--input-focus":      "#38bdf8",
    "--card-hover-shadow": "0 12px 28px rgba(16,24,40,0.15)",
    "--transition-speed": "0.3s"
  },
  "bodyClasses": [],
  "darkMode": false,
  "backgroundImage": null,
  "fontFamily": null
}
