{
  "id": "anime",
  "name": "二次元/动漫风 (Anime)",
  "description": "明亮色彩、渐变背景，充满趣味感，适合年轻群体",
  "icon": "🌸",
  "version": "2.0.0",
  "tags": ["anime", "kawaii", "pink", "soft", "youth"],
  "preview": {
    "primary":    "#ec4899",
    "accent":     "#a855f7",
    "background": "#fdf2f8",
    "surface":    "#fffbfe",
    "text":       "#3b0764"
  },
  "variables": {
    "--base-color":       "#f472b6",
    "--base-color-600":   "#db2777",
    "--base-color-500":   "#ec4899",
    "--base-color-300":   "#f9a8d4",
    "--bg-page":          "rgba(253,242,248,1)",
    "--bg-page-mid":      "rgba(250,232,255,1)",
    "--bg-page-end":      "rgba(255,240,250,1)",
    "--card-bg":          "rgba(255,255,255,0.80)",
    "--glass":            "rgba(255,255,255,0.65)",
    "--surface-1":        "#fdf4ff",
    "--surface-2":        "#ffffff",
    "--border-color":     "#f5d0fe",
    "--border-light":     "#fdf4ff",
    "--ink":              "#1e1b4b",
    "--text-primary":     "#3b0764",
    "--text-secondary":   "#7e22ce",
    "--text-muted":       "#c084fc",
    "--radius-xs":        "8px",
    "--radius-sm":        "12px",
    "--radius-md":        "16px",
    "--radius-lg":        "20px",
    "--radius-xl":        "24px",
    "--radius-2xl":       "32px",
    "--shadow-xs":        "0 2px 6px rgba(236,72,153,0.10)",
    "--shadow-sm":        "0 4px 12px rgba(236,72,153,0.14)",
    "--shadow-md":        "0 8px 24px rgba(168,85,247,0.16)",
    "--shadow-lg":        "0 16px 40px rgba(168,85,247,0.20)",
    "--blur-panel":       "24px",
    "--accent-gradient":  "linear-gradient(135deg,#f472b6,#a855f7,#38bdf8)",
    "--btn-radius":       "32px",
    "--input-border":     "#f5d0fe",
    "--input-focus":      "#ec4899",
    "--card-hover-shadow": "0 16px 48px rgba(168,85,247,0.25)",
    "--card-hover-transform": "translateY(-6px) rotate(1deg)",
    "--transition-speed": "0.4s",
    "--bounce-timing":    "cubic-bezier(0.34, 1.56, 0.64, 1)"
  },
  "bodyClasses": ["theme-anime"],
  "darkMode": false,
  "backgroundImage": null,
  "fontFamily": "'Noto Sans SC', sans-serif"
}
