{
  "id": "tech",
  "name": "科技未来风 (Tech/Futuristic)",
  "description": "霓虹渐变、几何线条，科技感与未来感兼具",
  "icon": "🚀",
  "version": "1.0.0",
  "tags": ["tech", "futuristic", "neon", "dark", "cyberpunk"],
  "preview": {
    "primary":    "#06b6d4",
    "accent":     "#8b5cf6",
    "background": "#0f1629",
    "surface":    "#1e2640",
    "text":       "#e2e8f0"
  },
  "variables": {
    "--base-color":       "#06b6d4",
    "--base-color-600":   "#0891b2",
    "--base-color-500":   "#22d3ee",
    "--base-color-300":   "#67e8f9",
    "--bg-page":          "rgba(15,22,41,1)",
    "--bg-page-mid":      "rgba(17,24,44,1)",
    "--bg-page-end":      "rgba(30,20,50,1)",
    "--card-bg":          "rgba(30,38,64,0.90)",
    "--glass":            "rgba(30,38,64,0.75)",
    "--surface-1":        "rgba(15,22,41,0.80)",
    "--surface-2":        "rgba(30,38,64,1.0)",
    "--border-color":     "rgba(6,182,212,0.25)",
    "--border-light":     "rgba(6,182,212,0.12)",
    "--ink":              "#e2e8f0",
    "--text-primary":     "#f1f5f9",
    "--text-secondary":   "#94a3b8",
    "--text-muted":       "#475569",
    "--radius-xs":        "3px",
    "--radius-sm":        "6px",
    "--radius-md":        "8px",
    "--radius-lg":        "10px",
    "--radius-xl":        "12px",
    "--radius-2xl":       "16px",
    "--shadow-xs":        "0 1px 4px rgba(6,182,212,0.15)",
    "--shadow-sm":        "0 3px 10px rgba(6,182,212,0.18)",
    "--shadow-md":        "0 6px 20px rgba(139,92,246,0.20)",
    "--shadow-lg":        "0 12px 36px rgba(139,92,246,0.24)",
    "--blur-panel":       "20px",
    "--accent-gradient":  "linear-gradient(90deg,#06b6d4,#8b5cf6)"
  },
  "bodyClasses": ["theme-tech"],
  "darkMode": true,
  "backgroundImage": null,
  "fontFamily": "'JetBrains Mono', 'Fira Code', 'Consolas', monospace"
}
