{
  "id": "minimalist",
  "name": "极简风 (Minimalist)",
  "description": "简洁排版、大量留白，突出内容本身。适合注重效率的用户",
  "icon": "✨",
  "version": "2.0.0",
  "tags": ["clean", "minimal", "modern", "blog"],
  "preview": {
    "primary":    "#2563eb",
    "accent":     "#0066ff",
    "background": "#f8f9fa",
    "surface":    "#ffffff",
    "text":       "#1a1a1a"
  },
  "variables": {
    "--base-color":       "#3b82f6",
    "--base-color-600":   "#1d4ed8",
    "--base-color-500":   "#3b82f6",
    "--base-color-300":   "#93c5fd",
    "--bg-page":          "#f8f9fa",
    "--bg-page-mid":      "#f8f9fa",
    "--bg-page-end":      "#f8f9fa",
    "--card-bg":          "rgba(255,255,255,1.0)",
    "--glass":            "rgba(255,255,255,0.98)",
    "--surface-1":        "#f4f4f5",
    "--surface-2":        "#ffffff",
    "--border-color":     "#e4e4e7",
    "--border-light":     "#f4f4f5",
    "--ink":              "#18181b",
    "--text-primary":     "#18181b",
    "--text-secondary":   "#52525b",
    "--text-muted":       "#a1a1aa",
    "--radius-xs":        "2px",
    "--radius-sm":        "4px",
    "--radius-md":        "6px",
    "--radius-lg":        "8px",
    "--radius-xl":        "10px",
    "--radius-2xl":       "12px",
    "--shadow-xs":        "0 1px 2px rgba(0,0,0,0.04)",
    "--shadow-sm":        "0 1px 4px rgba(0,0,0,0.06)",
    "--shadow-md":        "0 2px 8px rgba(0,0,0,0.08)",
    "--shadow-lg":        "0 4px 12px rgba(0,0,0,0.10)",
    "--blur-panel":       "0px",
    "--accent-gradient":  "#3b82f6",
    "--btn-radius":       "4px",
    "--input-border":     "#e4e4e7",
    "--input-focus":      "#3b82f6",
    "--card-hover-shadow": "0 2px 6px rgba(0,0,0,0.06)",
    "--transition-speed": "0.2s"
  },
  "bodyClasses": ["theme-minimalist"],
  "darkMode": false,
  "backgroundImage": null,
  "fontFamily": "'Inter', 'Helvetica Neue', Arial, sans-serif"
}
